district,church_name,pastor,address,state,zip_code,phone
North Dakota,Abundant Life Assembly of God,,"106 3rd St N Hettinger, ND 58639",ND,58639,(701) 567-4348
North Dakota,All Nations Assembly of God,Reverend Isaac Charles Sevlie,"121 48Th Ave SE Bismarck, ND 58504",ND,58504,(701) 250-8797
North Dakota,All Nations Assembly of God,Reverend Paul J Agamiri,"2410 Great Northern Dr N Fargo, ND 58102",ND,58102,(218) 790-2582
North Dakota,Assembly of God,Reverend Ed M Kvaale,"606 4th St SW Bowman, ND 58623",ND,58623,(701) 523-5544
North Dakota,Assembly of God,Michael L Rohrer,"1107 2nd Ave Cando, ND 58324",ND,58324,(701) 968-3594
North Dakota,Assembly of God,Reverend Leslie D Anderson,"401 S Main Crosby, ND 58730",ND,58730,(701) 965-6535
North Dakota,Assembly of God,,"311 S Main St Elgin, ND 58533",ND,58533,(701) 584-2276
North Dakota,Assembly of God,Reverend Mark A Flaten,"Hwy 32 N Finley, ND 58230",ND,58230,(701) 524-1124
North Dakota,Assembly of God,Reverend Matthew D Aufenkamp,"1593 Griggs Ave Grafton, ND 58237",ND,58237,(701) 352-0867
North Dakota,Assembly of God,Reverend J Kevin Shumway,"1020 Millenium Dr Harvey, ND 58341",ND,58341,(701) 324-4985
North Dakota,Assembly of God,,"108 2nd St SW Kulm, ND 58456",ND,58456,(701) 647-2734
North Dakota,Assembly of God,,"7895 7th Ave SE Linton, ND 58552",ND,58552,(701) 254-4190
North Dakota,Assembly of God,Charles F Springer,"324 Avenue B E McClusky, ND 58463",ND,58463,(701) 363-2417
North Dakota,Assembly of God,Reverend Stephen W Denn,"145 N Main St Regan, ND 58477",ND,58477,(701) 204-1768
North Dakota,Assembly of God,Reverend Eugene D Wilson,"Sixth & State Rolette, ND 58366",ND,58366,(701) 246-3250
North Dakota,Assembly of God,"Reverend Randolph L Hahne, Sr.","112 1st Ave North Selfridge, ND 58568",ND,58568,(605) 840-9004
North Dakota,Assembly of God,,"100 South Ave Stanton, ND 58571",ND,58571,(701) 745-3766
North Dakota,Assembly of God,Reverend Andrew D Sheldon,"19 4th St NW Tioga, ND 58852",ND,58852,(701) 664-2604
North Dakota,Assembly of God,Reverend Alan R Klitzke,"300 5th St Walhalla, ND 58282",ND,58282,(701) 549-3113
North Dakota,Assembly of God,Reverend Dustin G Harper,"Hwy 85 S Watford City, ND 58854",ND,58854,(701) 842-3353
North Dakota,Bethel Assembly of God,Reverend Donald H Hill,"129 2nd Ave SE Ashley, ND 58413",ND,58413,(605) 520-4384
North Dakota,Bethel Assembly of God,Reverend Kevin A Gustafson,"70 Poplar Ave S Carrington, ND 58421",ND,58421,(701) 652-3026
North Dakota,Bethel Assembly of God,Reverend Tony Sifuentes,"203 F St S Glen Ullin, ND 58631",ND,58631,(701) 348-3334
North Dakota,Bethel Assembly of God,Reverend James D McEachran,"200 Shady Ln Mandan, ND 58554",ND,58554,(701) 663-0303
North Dakota,Capital Church,"Reverend Clarence D Kent, II","3838 Jericho Rd Bismarck, ND 58503",ND,58503,(701) 255-1388
North Dakota,Cavalier Assembly of God,Reverend Rodney L Madding,"605 Main St W Cavalier, ND 58220",ND,58220,(701) 270-8675
North Dakota,Cielos Abiertos,Reverend Liliana Rodriguez,"59 Osborn Dr Dickinson, ND 58601",ND,58601,(701) 590-1781
North Dakota,Dazey Assembly of God,Reverend Foster W Beckstrand,"224 5TH St Dazey, ND 58429",ND,58429,(701) 733-2158
North Dakota,Evangel,Reverend Joshua D Skjoldal,"3225 N 14th St Bismarck, ND 58503",ND,58503,(701) 255-0500
North Dakota,Evangel Dickinson Campus,Reverend Logan K Gross,"3225 N 14th St Bismarck, ND 58503",ND,58503,(701) 255-0500
North Dakota,Evangel Garrison Campus,Reverend Andrew J Storsved,"101 N Main St Garrison, ND 58540",ND,58540,(701) 255-0500
North Dakota,Faith Assembly of God,,"1010 Forest St Lisbon, ND 58054",ND,58054,(701) 683-5756
North Dakota,First Assembly of God,Reverend Jeffery Wiedenmeyer,"1720 8th Ave SW Jamestown, ND 58401",ND,58401,(701) 252-4092
North Dakota,Freedom Church,Reverend Nathan T Johnson,"308 Demers Ave Apt 1 Grand Forks, ND 58201",ND,58201,(701) 772-3117
North Dakota,Freedom Church Crookston,Reverend Nathan T Johnson,"101 W 2ND St Crookston, MN 56716",MN,56716,(701) 772-3117
North Dakota,Full Life Assembly of God,Reverend Samuel R Acquah,"400 22nd Ave NW Minot, ND 58703",ND,58703,(701) 339-9091
North Dakota,Glad Tidings Assembly of God,Reverend Nathan J Steen,"314 3rd Ave SW Rugby, ND 58368",ND,58368,(701) 776-5704
North Dakota,Golden Harvest Church,Reverend Tony Sifuentes,"212 Iowa Ave Mott, ND 58646",ND,58646,(701) 824-2009
North Dakota,Gospel Tabernacle,Reverend Brian H Skaar,"153 W Curtis Ave Binford, ND 58416",ND,58416,(701) 247-2875
North Dakota,Gospel Tabernacle,Reverend Cary L Enno,"101 W 4th Pl New Town, ND 58763",ND,58763,(701) 627-3531
North Dakota,Halliday Assembly of God,Reverend Barry D Van Wagner,"220 E Railroad St E Halliday, ND 58636",ND,58636,(701) 938-4418
North Dakota,Harvest Outreach Church of the Assemblies of God,Reverend Dominick D Warne,"1155 21st Ave N Wahpeton, ND 58075",ND,58075,(701) 642-9445
North Dakota,Harvest Valley Church,"Reverend Randolph L Hahne, Jr.","6350 76th Ave S Horace, ND 58047",ND,58047,(701) 212-3796
North Dakota,Harvest Valley Church,"Reverend Randolph L Hahne, Jr.","6350 76th Ave S Horace, ND 58047",ND,58047,(701) 212-3796
North Dakota,Harvest Valley Church -North Fargo,Reverend Nathan D Leedahl,"670 4th Ave N Fargo, ND 58102",ND,58102,(701) 866-9954
North Dakota,Heartland Community Church,Reverend Ethan M Zaun,"1751 Main Ave E West Fargo, ND 58078",ND,58078,(701) 866-9305
North Dakota,Journey Church Assembly of God,Reverend Daniel M Dangerfield,"1805 2nd St SE Minot, ND 58701",ND,58701,(701) 838-1111
North Dakota,Journey Church Assembly of God,Reverend Kayla M Buckley,"1102 County Road 22 Washburn, ND 58577",ND,58577,(701) 838-1111
North Dakota,Lake Assembly of God,Reverend Jerald J Dvorscak,"101 2nd Ave E Powers Lake, ND 58773",ND,58773,(701) 464-5612
North Dakota,Life Church Assembly of God,Reverend Vondell K Brandt,"1905 26th St W Williston, ND 58801",ND,58801,(701) 572-5042
North Dakota,Lighthouse Assembly of God,Reverend Michael Joseph Cruz,"830 S 18th St Bismarck, ND 58504",ND,58504,(701) 516-6645
North Dakota,Lighthouse Assembly of God,Reverend Brandon W Wegener,"418 Streifel Rd W Fort Totten, ND 58335",ND,58335,(701) 766-4826
North Dakota,New Hope Fellowship,"Reverend Norman C Economy, Jr.","314 15th Ave Langdon, ND 58249",ND,58249,(701) 256-3979
North Dakota,New Life Assembly of God,Reverend Leroy Aufenkamp,"400 Brown Ave Drayton, ND 58225",ND,58225,(701) 454-3396
North Dakota,New Life Assembly of God,Reverend Kevin Libby,"720 3rd Ave N Ellendale, ND 58436",ND,58436,(701) 349-5449
North Dakota,New Life Assembly of God,Reverend Kevin E Zaun,"520 Wintershow Rd SW Valley City, ND 58072",ND,58072,(701) 845-2259
North Dakota,New Life Church,Reverend Marc P Eidahl,"1320 Tacoma Ave Bismarck, ND 58504",ND,58504,(701) 751-0799
North Dakota,New Life Church - Jamestown,,"2717 Highway 281 S Jamestown, ND 58401",ND,58401,(701) 873-5400
North Dakota,New Life Underwood,Reverend Ernest C Keplin,"519 Borchardt Ave Underwood, ND 58576",ND,58576,(701) 442-3130
North Dakota,New Life Worship Center,Reverend Ron L Enget,"416 7th St NW Beulah, ND 58523",ND,58523,(701) 707-9852
North Dakota,North Dakota Ministry,,"1724 N Grandview Ln Bismarck, ND 58503",ND,58503,(701) 255-2526
North Dakota,Northview Church,Reverend David D Leedahl,"3401 25th St S Fargo, ND 58104",ND,58104,(701) 232-0003
North Dakota,River of Life Assembly of God,Reverend Kevin J Anderson,"1903 Highway 20 Devils Lake, ND 58301",ND,58301,(701) 662-4582
North Dakota,River of Life Assembly of God,Reverend Kevin J Anderson,"1903 Highway 20 Devils Lake, ND 58301",ND,58301,(701) 662-4582
North Dakota,River of Life Assembly of God,Reverend Corey A Rice,"400 22nd Ave NW Ste 2 Minot, ND 58703",ND,58703,(701) 858-7777
North Dakota,River of Life Church International,Reverend Jalyn R McGill,"59 Osborn Dr Dickinson, ND 58601",ND,58601,(701) 225-3698
North Dakota,Rock Church,Reverend Scott J Kruse,"West Acres Cinema 4101 17th Ave SW Fargo, ND 58103",ND,58103,(701) 261-2709
North Dakota,Standing Rock Gospel Mission,"Reverend Randolph L Hahne, Sr.","221 Oahe Ave Fort Yates, ND 58538",ND,58538,(605) 840-9004
North Dakota,Stanley River of Life Church,Reverend Byron L Lindbo,"8155 Highway 2 Stanley, ND 58784",ND,58784,(701) 628-3390
North Dakota,Turtle Mountain Worship Center,,"Highway 4 E Belcourt, ND 58316",ND,58316,(701) 477-6017
North Dakota,United Community Church,Reverend Delbert W Maxted,"335 N Central Ave Beach, ND 58621",ND,58621,(701) 218-0888
North Dakota,Valley Christian Church Assembly of God,Reverend Chris E Dawes,"3920 Cherry St Grand Forks, ND 58201",ND,58201,(701) 746-7327
North Dakota,WCAG Belfield,Reverend Tobin N Arnold,"101 2nd Ave NE Belfield, ND 58622",ND,58622,(406) 971-9645
North Dakota,WCAG Fairview,Reverend Layne J McCarthy,"610 S Ellery Ave Fairview, MT 59221",MT,59221,(701) 842-3353
North Dakota,WCAG Kenmare,Reverend Kristan D Faul,"49303 Highway 52 N Kenmare, ND 58746",ND,58746,(701) 720-6234